Category,Job,Location,Description,Responsibilities,Experience,Benefits
Accounting & Finance,Manage budgets and prepare financial reports,New York,This role involves managing company budgets and preparing detailed financial reports for stakeholders,"Budget planning, Financial analysis","5+ years in accounting, CPA preferred","Health insurance, 401(k)"
Accounting & Finance,Handle tax audits and compliance,London,Ensure compliance with tax regulations and oversee internal audits for tax purposes,"Audit oversight, Tax compliance","3+ years in tax-related roles, Strong knowledge of tax laws","Flexible hours, Comprehensive health benefits"
Bikes & Scooters,Design new scooter models,New York,Work on the design and development of innovative scooter models,"Product design, Prototype development","2+ years in product design, Engineering degree","Remote work options, Stock options"
Bikes & Scooters,Oversee maintenance programs,London,Manage maintenance programs to ensure scooter availability and safety,"Maintenance planning, Quality assurance","3+ years in maintenance management","Travel perks, Health insurance"
Business Development & Partnerships,Develop strategic partnerships,New York,Identify and establish partnerships with key industry players,"Market analysis, Partnership building","4+ years in business development, Strong communication skills","Professional growth opportunities, Competitive salary"
Business Development & Partnerships,Negotiate high-value deals,San Francisco,Lead negotiations for high-value deals to drive business growth,"Contract negotiation, Deal structuring","5+ years in business negotiations, MBA preferred","Flexible schedule, Bonus programs"